{
  "id": "irobot_roomba_combo_10_max_plus_autowash_dock",
  "kind": "model",
  "manufacturer": "iRobot",
  "name": "Roomba Combo 10 Max + AutoWash Dock",
  "public_model_ids": [],
  "regional_skus": [],
  "integration_candidates": [
    "roomba"
  ],
  "reservoirs_ml": {
    "dock_clean": null,
    "dock_dirty": null,
    "robot_clean": null,
    "robot_dirty": null,
    "detergent": null
  },
  "inventory_status": "researched_partial",
  "provenance": [
    {
      "url": "https://homesupport.irobot.com/articles/en_US/Knowledge/10009",
      "date": "2026-09-05",
      "type": "manufacturer",
      "claim": "Model/reference source; reservoir values only adopted where separately confirmed in root review."
    },
    {
      "url": "https://answers.irobot.com/nl-NL/knowledge/163",
      "date": "2026-09-05",
      "type": "manufacturer",
      "claim": "Model/reference source; reservoir values only adopted where separately confirmed in root review."
    },
    {
      "url": "https://www.home-assistant.io/integrations/roomba",
      "date": "2026-09-05",
      "type": "integration_code",
      "claim": "Model/reference source; reservoir values only adopted where separately confirmed in root review."
    }
  ],
  "confidence": "unknown",
  "unknowns": [
    "Regional hardware equivalence and exact retail SKU unknown",
    "Firmware-specific HA feature presence unverified",
    "All consumption rates and wash volumes unmeasured",
    "Reservoir null means unknown, not zero or absent",
    "Unknown dock_clean capacity",
    "Unknown dock_dirty capacity",
    "Unknown robot_clean capacity",
    "Unknown robot_dirty capacity",
    "Unknown detergent capacity"
  ]
}
