{
  "id": "roborock_qrevo_curv_2_flow",
  "kind": "model",
  "manufacturer": "Roborock",
  "name": "Qrevo Curv 2 Flow",
  "public_model_ids": [
    "a245",
    "roborock.vacuum.a245"
  ],
  "regional_skus": [],
  "integration_candidates": [
    "roborock",
    "xiaomi_miio"
  ],
  "reservoirs_ml": {
    "dock_clean": null,
    "dock_dirty": null,
    "robot_clean": null,
    "robot_dirty": null,
    "detergent": null
  },
  "inventory_status": "researched_partial",
  "provenance": [
    {
      "url": "https://global.roborock.com/pages/roborock-qrevo-curv-2-flow",
      "date": "2026-09-05",
      "type": "manufacturer",
      "claim": "Model/reference source; reservoir values only adopted where separately confirmed in root review."
    },
    {
      "url": "https://github.com/MacSiem/ha-vacuum-water-monitor/issues/12",
      "date": "2026-09-05",
      "type": "integration_code",
      "claim": "Reporter supplied model identifier; not manufacturer capacity evidence."
    }
  ],
  "confidence": "unknown",
  "unknowns": [
    "Regional hardware equivalence and exact retail SKU unknown",
    "Firmware-specific HA feature presence unverified",
    "All consumption rates and wash volumes unmeasured",
    "Reservoir null means unknown, not zero or absent",
    "Unknown dock_clean capacity",
    "Unknown dock_dirty capacity",
    "Unknown robot_clean capacity",
    "Unknown robot_dirty capacity",
    "Unknown detergent capacity"
  ]
}
