{
  "id": "eufy_omni_c20",
  "kind": "model",
  "manufacturer": "eufy",
  "name": "Omni C20",
  "public_model_ids": [],
  "regional_skus": [],
  "integration_candidates": [],
  "reservoirs_ml": {
    "dock_clean": null,
    "dock_dirty": null,
    "robot_clean": null,
    "robot_dirty": null,
    "detergent": null
  },
  "inventory_status": "researched_partial",
  "provenance": [
    {
      "url": "https://us.eufy.com/blogs/robovac/eufy-robot-vacuum-buying-guide",
      "date": "2026-09-05",
      "type": "manufacturer",
      "claim": "Named model in reviewed source; unknown values are not compatibility or capacity claims."
    }
  ],
  "confidence": "unknown",
  "unknowns": [
    "Exact HA model identifier and firmware signal presence unverified",
    "Regional SKU equivalence unverified",
    "Consumption and wash rates unmeasured",
    "Null reservoir capacities mean unknown, not absent"
  ]
}
