{
  "id": "switchbot_s20",
  "kind": "model",
  "manufacturer": "SwitchBot",
  "name": "S20",
  "public_model_ids": [],
  "regional_skus": [],
  "integration_candidates": [
    "switchbot_cloud"
  ],
  "reservoirs_ml": {
    "dock_clean": null,
    "dock_dirty": null,
    "robot_clean": null,
    "robot_dirty": null,
    "detergent": null
  },
  "inventory_status": "researched_partial",
  "provenance": [
    {
      "url": "https://www.switch-bot.com/pages/your-dream-cleaning-assistant-is-here-2",
      "date": "2026-09-05",
      "type": "manufacturer",
      "claim": "Named model in reviewed source; unknown values are not compatibility or capacity claims."
    }
  ],
  "confidence": "unknown",
  "unknowns": [
    "Exact HA model identifier and firmware signal presence unverified",
    "Regional SKU equivalence unverified",
    "Consumption and wash rates unmeasured",
    "Null reservoir capacities mean unknown, not absent"
  ]
}
